{
  "ref": "ev-011",
  "packetId": "wp-b2d002",
  "role": "coder",
  "kind": "test_run",
  "verdict": "fail",
  "artifacts": ["sha256:11aa22bb33cc44dd55ee66ff778899001122334455667788990011223344aabb"],
  "prevDigest": "sha256:0000000000000000000000000000000000000000000000000000000000000000",
  "digest": "sha256:a1b2c3d4e5f60718293a4b5c6d7e8f90a1b2c3d4e5f60718293a4b5c6d7e8f90",
  "at": "2026-08-02T09:52:10.000Z",
  "detail": "attempt 1/3：tests/auth 4 项未过"
}
